{
  "profileId": "xrpl-testnet-xcs-v0.1-example",
  "xcsVersion": "0.1",
  "networkId": 1,
  "requiredAmendment": "1CB67D082CF7D9102412D34258CEDB400E659352D3B207348889297A6D90F5EF",
  "registryAddress": "rEXAMPLEReplaceAfterBlackholeCeremony111",
  "registrationAmountDrops": "1",
  "activationLedgerIndex": 0,
  "activationLedgerHash": "0000000000000000000000000000000000000000000000000000000000000000"
}
